location_id,type,name,description,city,country,amenities,styles,ranking,rating,num_reviews,price_level
1995299,hotels,Doubletree By Hilton Ras Al Khaimah,"Overlooking the Ras al Khaimah Creek, this 4-star hotel features a rooftop pool with a lounge and a bar with panoramic city and mountain views. It offers elegant rooms and suites and a free private parking. The air-conditioned rooms at the Doubletree Ras Al Khaimah have a seating area with modern furnishings and a 32’flat-screen TV. In-room dining is available upon request. The hotel’s Fitness by Precor has cardio equipment and free weights. Guests can also take a free shuttle to Hampton by Hilton Marjan Island, where extensive facilities include infinity pool, kids club and pool, water sports center, an array of outdoor recreational facilities and a 750-meter private beach. The hotel offers international cuisine at Podium Restaurant. There is also a lobby bar serving coffee and cookies. For light refreshments and shishas, the TreeTop Bar offers a relaxed space during the day and a party atmosphere in the evenings. Dubai International Airport is 50 minutes away by car.",Ras Al Khaimah,United Arab Emirates,"Internet, Wifi, Paid Wifi, Paid Internet, Pool, Free parking, Restaurant, Fitness center, Room service, Wheelchair access, Business center, Shuttle Bus Service, Suites, Bar/Lounge, Spa, Airport transportation, Public Wifi, Dry Cleaning, Meeting rooms, Non-smoking rooms, Laundry Service, Concierge, Banquet Room, Air conditioning, Family Rooms, Multilingual Staff, Accessible rooms, Minibar, Conference Facilities, Safe, Rooftop Bar, Rooftop Pool, Flatscreen TV, Rooftop Terrace, Breakfast Buffet, Poolside Bar, Outdoor pool, Private Beaches, Free Shuttle or Taxi Services, Facilities for Disabled Guests, Kids Stay Free, Arabic, Baggage Storage, Car Hire, Currency Exchange, English, Filipino, Fitness / Spa Locker Rooms, 24-Hour Front Desk, Hindi, Ironing Service, 24-Hour Security, Steam Room, Taxi Service, VIP Room Facilities, Breakfast Available","Mid-range, Quiet",#20 of 49 hotels in Ras Al Khaimah,4.5,1794,
4092412,hotels,Waldorf Astoria Ras Al Khaimah,"Nestled between the azure waters of the Arabian Gulf, lush golf course, and majestic Hajar mountains, Waldorf Astoria Ras Al Khaimah is the ultimate destination for families and couples. Enjoy our renowned beach resort, lagoon pool, adult beach club, and award-winning dining. Explore the water playground and kids club, dine in style, or rejuvenate in our spa. With 203 deluxe rooms and suites offering panoramic views, this escape offers unparalleled luxury and tranquility. Indulge in signature dining experiences, from Lexington Grill & Bar to UMI and Qasr Al Bahar. Our spa, gym, and outdoor pools provide relaxation. Waldorf Astoria Ras Al Khaimah is the ideal venue for gatherings, celebrations, conferences, weddings, and more, ensuring unforgettable moments with personalized service.",Ras Al Khaimah,United Arab Emirates,"Beachfront, Beach Access, Free parking, Fitness center, Kids Activities, Room service, Golf course, Non-smoking rooms, Laundry Service, Pool, Internet, Suites, Free Internet, Wheelchair access, Restaurant, Bar/Lounge, Airport transportation, Wifi, Paid Wifi, Breakfast included, Dry Cleaning, Meeting rooms, Hot Tub, Tennis Court, Business center, Concierge, Banquet Room, Air conditioning, Family Rooms, Multilingual Staff, Accessible rooms, Refrigerator in room, Minibar, Conference Facilities, Babysitting, Safe, Swimup Bar, Heated pool, Flatscreen TV, Breakfast Buffet, Poolside Bar, Private Balcony, Butler Service, Adult pool, Outdoor pool, Private Beaches, Breakfast Available, Parking, Facilities for Disabled Guests, Housekeeping, Kids Club, Kids Stay Free, Sauna, Additional Bathroom, Allergy-free Room, Arabic, Baggage Storage, Bathrobes, Car Hire, Couples Massage, Currency Exchange, Doorperson, English, Entertainment Staff, Facial Treatments, Fitness Classes, Fitness / Spa Locker Rooms, 24-Hour Front Desk, Full Body Massage, German, Head Massage, Indoor Play Area for Children, Ironing Service, Laptop Safe, Massage, Pool / Beach Towels, Russian, Salon, 24-Hour Security, Shoeshine, Shops, Steam Room, Sun Loungers / Beach Chairs, Sun Umbrellas, Taxi Service, Valet Parking, VIP Room Facilities","Ocean View, Modern",#2 of 49 hotels in Ras Al Khaimah,4.5,6457,$$$
27100792,hotels,Anantara Mina Al Arab Ras Al Khaimah Resort,"Ras Al Khaimah is where glamorous beach life meets adventures of the ocean, mountains and desert, and Anantara boasts one of the destination’s most enviable settings, a private peninsula of golden sands that overlooks lagoon then open ocean. Luxuriate in one of 174 rooms, suites and pool villas, including the emirate’s first overwater villas, each an eco-sanctuary built in harmony with nature. Traverse the culinary globe, from Asia to the Mediterranean and back to the Arabian Peninsula, and enjoy cocktails and shisha at sunset.",Al Riffa,United Arab Emirates,"Pool, Kids Activities, Beachfront, Suites, Room service, Free parking, Wheelchair access, Restaurant, Bar/Lounge, Spa, Airport transportation, Free Wifi, Dry Cleaning, Meeting rooms, Non-smoking rooms, Fitness center, Laundry Service, Concierge, Breakfast Buffet, Poolside Bar, Private Balcony, Outdoor pool, Breakfast Available, Kids Club, Electric vehicle charging station, Allergy-free Room, Arabic, Bath / Shower, Bathrobes, Bottled Water, Private Check-in / Check-out, Beach Access, Free Internet, Wifi, Business center, Banquet Room, Air conditioning, Family Rooms, Minibar, Conference Facilities, Safe, Swimup Bar, Flatscreen TV, Kids pool, Parking, Facilities for Disabled Guests, Blackout Curtains, Body Wrap, Breakfast in the Room, Children's Television Networks, Coffee Shop, Coffee / Tea Maker, Couples Massage, Currency Exchange, Desk, Doorperson, English, Facial Treatments, First Aid Kit, Foot Bath, Foot Massage, Complimentary Toiletries, Complimentary Welcome Drink, 24-Hour Front Desk, Full Body Massage, Gift Shop, Hair Dryer, Hand Massage, Head Massage, Highchairs Available, Hindi, Indoor Play Area for Children, Iron, Ironing Service, Kids' Meals, Kid-Friendly Buffet, Laptop Safe, Manicure, Massage, Massage Chair, Neck Massage, Outdoor Dining Area, Outdoor Furniture, Pedicure, Personal Trainer, Pool / Beach Towels, Pool View, Pool with View, Private Bathrooms, Russian, Salon, Seating Area, 24-Hour Security, Secured Parking, Shoeshine, Sofa, Soundproof Rooms, Special Diet Menus, Steam Room, Sun Loungers / Beach Chairs, Sun Umbrellas, Telephone, Valet Parking, Wake Up Service / Alarm Clock, Walk-in Shower, Wardrobe / Closet, Wine / Champagne, Yoga Classes","Charming, Luxury",#1 of 4 hotels in Al Riffa,5.0,590,$$$
21144688,hotels,Action Hotel Ras Al Khaimah,,Ras Al Khaimah,United Arab Emirates,"Internet, Suites, Room service, Free Internet, Free parking, Wheelchair access, Restaurant, Bar/Lounge, Kitchenette, Airport transportation, Wifi, Free Wifi, Dry Cleaning, Meeting rooms, Non-smoking rooms, Business center, Fitness center, Laundry Service, Concierge, Banquet Room, Air conditioning, Family Rooms, Multilingual Staff, Smoking rooms available, Accessible rooms, Minibar, Conference Facilities, Safe, Breakfast Buffet, Kids Stay Free, Arabic, 24-Hour Check-in, Filipino, 24-Hour Front Desk, Hindi, Ironing Service, 24-Hour Security, Breakfast Available","Centrally Located, Business",#12 of 49 hotels in Ras Al Khaimah,4.5,237,$
582692,hotels,BM Beach Resort,"Sprawling across a sandy 500 meter stretch of private beach with a view of Marjan Island, The BM Beach Resort offers a relaxing and stress-free stay in Ras Al Khaimah. With 253 chalets and cabanas, all guests can enjoy three different resort pools, diverse dining options, beachside bars, and unparalleled views of the Arabian Gulf. Perfect for couples looking for a romantic getaway, large groups looking for fun and sun, or parents looking to relax while their kids frolic. This property is also dog-friendly, making it ideal for weekends away with your K9 friend. Book now to experience leisure by the beach, the BM way.",Ras Al Khaimah,United Arab Emirates,"Pool, Free parking, Restaurant, Room service, Beachfront, Beach Access, Bar/Lounge, Fitness center, Internet, Kids Activities, Suites, Free Internet, Wheelchair access, Airport transportation, Wifi, Dry Cleaning, Meeting rooms, Non-smoking rooms, Tennis Court, Laundry Service, Concierge, Banquet Room, Air conditioning, Family Rooms, Multilingual Staff, Smoking rooms available, Accessible rooms, Conference Facilities, Safe, Swimup Bar, Flatscreen TV, Water Park, Breakfast Buffet, Poolside Bar, Private Balcony, Outdoor pool, Private Beaches, Breakfast Available, Parking, Facilities for Disabled Guests, Housekeeping, Kids Club, Kids Stay Free, Sauna, Aerobics, Arabic, Baggage Storage, Billiards, Blackout Curtains, Board Games / Puzzles, Bottled Water, Breakfast in the Room, Car Hire, 24-Hour Check-in, Coffee / Tea Maker, Complimentary Tea, Currency Exchange, Darts, Desk, English, Entertainment Staff, Evening Entertainment, Fitness Classes, Fitness / Spa Locker Rooms, Complimentary Instant Coffee, Complimentary Toiletries, 24-Hour Front Desk, Gift Shop, Hair Dryer, Indoor Play Area for Children, Interconnected room(s) available, Ironing Service, Kids' Meals, Kid-Friendly Buffet, Kids' Outdoor Play Equipment, Nightclub / DJ, Pool / Beach Towels, Pool with View, Russian, Seating Area, 24-Hour Security, Secured Parking, Shops, Snack Bar, Sun Loungers / Beach Chairs, Sun Umbrellas, Taxi Service, Telephone, Wake Up Service / Alarm Clock, Bidet, Children's Playground, Clothes Rack, Electric Kettle, First Aid Kit, Happy Hour, Highchairs Available, Outdoor Dining Area, Pool View, Private Bathrooms, Separate Living Room, Sofa, Tile / Marble Floor, Umbrella, Walk-in Shower, Wardrobe / Closet, Waterslide, Water Sport Equipment Rentals, Photo Copier / Fax In Business Center, Yoga Classes","Park View, Mid-range",#21 of 49 hotels in Ras Al Khaimah,4.5,2570,$$
1026211,hotels,W Doha,"The first luxury, lifestyle hotel in Doha, Qatar, W Doha brings all the energy of New York City to vibrant Doha. Located in the heart of Doha’s West Bay, each hotel room and apartment is filled with iconic design, tech-savvy amenities, and a stylish ambiance. Indulge in ultimate relaxation with our beach access just few steps away. Savor award-winning cuisine at Market by Jean-Georges or Spice Market; both restaurants are host to three-star Michelin Chef Jean-Georges Vongerichten. Indulge in Italian cuisine at La Spiga by Paper Moon. Go on a journey to Latin America through exceptional Peruvian food at COYA. Soak up the atmosphere in the W signature Living Room or linger over coffee at the W Café. Mingle with the crowd at Wahm, the indoor lounge. The choices for guests are endless at our luxury five-star hotel, from a relaxing experience at Doha’s first and only Sisley Paris Spa to a workout in the FIT gym and a swim in the WET pool.",Doha,Qatar,"Pool, Free parking, Room service, Restaurant, Business center, Fitness center, Spa, Suites, Internet, Wheelchair access, Wifi, Laundry Service, Concierge, Bar/Lounge, Airport transportation, Public Wifi, Dry Cleaning, Meeting rooms, Hot Tub, Banquet Room, Air conditioning, Family Rooms, Multilingual Staff, Smoking rooms available, Accessible rooms, Refrigerator in room, Minibar, Conference Facilities, Babysitting, Safe, Flatscreen TV, Rooftop Terrace, Breakfast Buffet, Poolside Bar, Butler Service, Parking, Facilities for Disabled Guests, Housekeeping, Kids Stay Free, Additional Bathroom, Afrikaans, Allergy-free Room, Arabic, ATM On Site, Baggage Storage, Bath / Shower, Books, DVDs, Music for Children, Bottled Water, Breakfast in the Room, Bridal Suite, Car Hire, Catalan, 24-Hour Check-in, Express Check-in / Check-out, Chinese, Clothes Dryer, Clothes Rack, Coffee Shop, Coffee / Tea Maker, Complimentary Tea, Currency Exchange, Desk, Doorperson, Dutch, English, Entertainment Staff, Evening Entertainment, Extra Long Beds, Facial Treatments, Filipino, Fitness Classes, Fitness / Spa Locker Rooms, Foot Massage, Complimentary Instant Coffee, French, 24-Hour Front Desk, German, Greek, Hair Dryer, Hammam, Hindi, Indonesian, Interconnected room(s) available, Iron, Ironing Service, Italian, Kids' Meals, Kid-Friendly Buffet, Malay, Massage, Newspaper, On-Demand Movies, Outdoor Fireplace, Outdoor Furniture, Pool / Beach Towels, Portuguese, Private Check-in / Check-out, Romanian, Russian, Salon, Seating Area, 24-Hour Security, Shoeshine, Snack Bar, Solarium, Spanish, Special Diet Menus, Steam Room, Sun Loungers / Beach Chairs, Taxi Service, Telephone, Thai, Turkish, Valet Parking, VIP Room Facilities, Wake Up Service / Alarm Clock, Wine / Champagne, Breakfast Available, Bidet, Cable / Satellite TV, Dining Area, Electric Kettle, Executive Lounge Access, Farsi, First Aid Kit, Foot Bath, Complimentary Welcome Drink, Full Body Massage, Hand Massage, Happy Hour, Head Massage, Highchairs Available, iPod Docking Station, Landmark View, Manicure, Pedicure, Personal Trainer, Radio, Serbian, Sofa, Sun Deck, Ukrainian, Umbrella, Walk-in Shower, Wardrobe / Closet, Photo Copier / Fax In Business Center","Trendy, Green",#1 of 256 hotels in Doha,5.0,4959,$$
2216044,hotels,Hilton Doha,"Set on the Corniche with its own private beach and in the heart of the Diplomatic district, Hilton Doha is the ideal destination for both business and leisure travelers. A 15 minute drive from Doha International Airport, in close proximity to major shopping malls, Souq Waqif, Katara and the Museum of Islamic Art, this Hotel boasts 309 rooms and suites overlooking breathtaking views of the Arabian Gulf.",Doha,Qatar,"Beachfront, Beach Access, Pool, Room service, Free parking, Business center, Fitness center, Internet, Kids Activities, Wheelchair access, Restaurant, Spa, Wifi, Paid Wifi, Suites, Free Internet, Bar/Lounge, Airport transportation, Dry Cleaning, Meeting rooms, Hot Tub, Non-smoking rooms, Laundry Service, Concierge, Banquet Room, Air conditioning, Family Rooms, Multilingual Staff, Smoking rooms available, Accessible rooms, Refrigerator in room, Minibar, Conference Facilities, Babysitting, Safe, Flatscreen TV, Breakfast Buffet, Poolside Bar, Private Balcony, Butler Service, Outdoor pool, Private Beaches, Breakfast Available, Parking, Facilities for Disabled Guests, Housekeeping, Kids Club, Kids Stay Free, Sauna, Additional Bathroom, Allergy-free Room, Arabic, ATM On Site, Baggage Storage, Bottled Water, Breakfast in the Room, Car Hire, 24-Hour Check-in, Express Check-in / Check-out, Coffee Shop, Coffee / Tea Maker, Couples Massage, Currency Exchange, Desk, Diving, Doorperson, English, Entertainment Staff, Evening Entertainment, Facial Treatments, Filipino, Fitness Classes, Fitness / Spa Locker Rooms, Foot Massage, French, 24-Hour Front Desk, Hair Dryer, Hammam, Head Massage, Hindi, Interconnected room(s) available, Ironing Service, Kids' Meals, Kid-Friendly Buffet, Massage, Newspaper, Nightclub / DJ, Pool / Beach Towels, Pool with View, Private Check-in / Check-out, Russian, Salon, 24-Hour Security, Shoeshine, Snack Bar, Snorkeling, Special Diet Menus, Steam Room, Sun Loungers / Beach Chairs, Taxi Service, Telephone, Valet Parking, VIP Room Facilities, Wake Up Service / Alarm Clock, Wine / Champagne, Public Wifi, Kids pool, Cable / Satellite TV, First Aid Kit, Free Wifi in the Business Center, Full Body Massage, Georgian, Hand Massage, Happy Hour, Infirmary, Laptop Safe, Manicure, Neck Massage, Outdoor Dining Area, Pedicure, Personal Trainer, Plunge Pool, Pool View, Private Bathrooms, Serbian, Sofa, Walk-in Shower, Wardrobe / Closet, Water Sport Equipment Rentals","Bay View, Ocean View",#28 of 256 hotels in Doha,4.5,5814,$$
12948576,hotels,Mondrian Doha,"Mondrian Doha was created with a mission to evoke an environment of love, filled with passion, and to make guests’ most exciting dreams come true. Capturing everything the Mondrian stands for; excitement, invincibility and glamour. Located in West Bay Lagoon, Doha, next to Lagoona Mall, Mondrian Doha is a must-see destination for residents as well as visitors to Qatar. Designed in collaboration with world-renowned Dutch designer, Marcel Wanders, along with South West Architecture, boasting innovative design and bespoke furniture, taking design inspiration from 1001 Nights, a collection of Middle Eastern folk tales and stories. Boasting 270 bedrooms over 27 floors, the hotel offers 8 F&B outlets - 3 bars, a rooftop pool, a fitness centre, a 2.000 sqm ESPA Spa and 2.000 sqm Wedding ballroom.",Doha,Qatar,"Pool, Internet, Suites, Room service, Free Internet, Free parking, Wheelchair access, Restaurant, Bar/Lounge, Spa, Airport transportation, Wifi, Public Wifi, Free Wifi, Breakfast included, Dry Cleaning, Meeting rooms, Non-smoking rooms, Business center, Fitness center, Laundry Service, Concierge, Banquet Room, Air conditioning, Family Rooms, Multilingual Staff, Smoking rooms available, Accessible rooms, Minibar, Conference Facilities, Non-smoking hotel, Safe, Rooftop Pool, Heated pool, Flatscreen TV, Rooftop Terrace, Breakfast Buffet, Indoor pool, Butler Service, Parking, Facilities for Disabled Guests, Housekeeping, Kids Club, Kids Stay Free, Sauna, Additional Bathroom, Allergy-free Room, Arabic, ATM On Site, Baggage Storage, Bath / Shower, Bathrobes, Blackout Curtains, Bottled Water, Breakfast in the Room, Bridal Suite, Car Hire, Catalan, 24-Hour Check-in, Clothes Dryer, Coffee Shop, Coffee / Tea Maker, Complimentary Tea, Couples Massage, Currency Exchange, Desk, Doorperson, English, Entertainment Staff, Evening Entertainment, Facial Treatments, Filipino, Fitness Classes, Fitness / Spa Locker Rooms, Complimentary Instant Coffee, Complimentary Toiletries, French, 24-Hour Front Desk, German, Hair Dryer, Hammam, Hindi, Interconnected room(s) available, Iron, Ironing Service, Italian, Kids' Meals, Massage, Nightclub / DJ, Pool / Beach Towels, Private Check-in / Check-out, Russian, Salon, Seating Area, 24-Hour Security, Secured Parking, Shoeshine, Soundproof Rooms, Spanish, Special Diet Menus, Steam Room, Taxi Service, Telephone, Turkish, Valet Parking, VIP Room Facilities, Wake Up Service / Alarm Clock, Breakfast Available, Azerbaijani, Cable / Satellite TV, Clothes Rack, Dining Area, Foot Massage, Full Body Massage, Happy Hour, iPod Docking Station, Makeup Services, Manicure, Neck Massage, On-Demand Movies, Outdoor Dining Area, Pedicure, Personal Trainer, Radio, Sofa, Walk-in Shower","Trendy, Boutique",#10 of 256 hotels in Doha,5.0,2108,$$
2527417,hotels,The St. Regis Doha,"Steeped in Middle Eastern mystique, The St. Regis Doha is located on the West Bay, near the Diplomatic District in Qatar's sophisticated capital city. The hotel borders the Arabian Gulf, where sand dunes, ancient architecture, and the scenic Pearl Island paint a magnificent landscape. Our timeless resort facilities comprise a cornucopia of destination restaurants and features world-class Guerlain Spa and offer direct access to the beach, where private cabanas await.",Doha,Qatar,"Pool, Free parking, Fitness center, Kids Activities, Beachfront, Room service, Spa, Beach Access, Restaurant, Bar/Lounge, Meeting rooms, Internet, Free Internet, Wifi, Free Wifi, Tennis Court, Laundry Service, Concierge, Suites, Wheelchair access, Airport transportation, Public Wifi, Dry Cleaning, Non-smoking rooms, Business center, Air conditioning, Family Rooms, Multilingual Staff, Smoking rooms available, Accessible rooms, Refrigerator in room, Minibar, Conference Facilities, Safe, Rooftop Bar, Flatscreen TV, Rooftop Terrace, Breakfast Buffet, Poolside Bar, Private Balcony, Butler Service, Outdoor pool, Private Beaches, Parking, Facilities for Disabled Guests, Housekeeping, Kids Club, Kids Stay Free, Sauna, Additional Bathroom, Aerobics, Allergy-free Room, Arabic, ATM On Site, Baggage Storage, Blackout Curtains, Bottled Water, Breakfast in the Room, Car Hire, 24-Hour Check-in, Currency Exchange, Desk, Doorperson, English, Entertainment Staff, Facial Treatments, Filipino, Fitness Classes, Fitness / Spa Locker Rooms, French, 24-Hour Front Desk, German, Gift Shop, Head Massage, Hindi, Interconnected room(s) available, Iron, Ironing Service, Italian, Massage, Nightclub / DJ, On-Demand Movies, Pool / Beach Towels, Pool with View, Private Check-in / Check-out, Russian, Salon, Seating Area, 24-Hour Security, Secured Parking, Shoeshine, Snack Bar, Spanish, Special Diet Menus, Steam Room, Sun Loungers / Beach Chairs, Sun Umbrellas, Taxi Service, Telephone, Turkish, Valet Parking, VIP Room Facilities, Wake Up Service / Alarm Clock, Kids pool, Breakfast Available, Azerbaijani, Bosnian, Clothes Rack, Georgian, Laptop Safe, Nepali, Pool View, Private Bathrooms, Separate Dining Area, Separate Living Room, Sofa, Squash Off-site, Tile / Marble Floor, Wardrobe / Closet","Green, Family",#2 of 256 hotels in Doha,5.0,5652,$$$
306474,hotels,"Radisson Blu Hotel, Doha","Welcome to the upscale metropolis of Doha, Qatar's capital, where the weather is idyllic and the sparkling Persian Gulf hugs the city's eastern border. The Radisson Blu Hotel, Doha is renowned for its attentive service and stunning interiors. Modern, stylish skyscrapers surround the hotel's prime location in the city center, close to the West Bay and Hamad International Airport. Top attractions such as the Museum of Islamic Art, Souq Waqif and MIA Park are all just short a drive from the hotel.",Doha,Qatar,"Pool, Free parking, Restaurant, Fitness center, Shuttle Bus Service, Room service, Wheelchair access, Internet, Free Internet, Bar/Lounge, Wifi, Free Wifi, Suites, Meeting rooms, Business center, Spa, Airport transportation, Public Wifi, Dry Cleaning, Hot Tub, Non-smoking rooms, Laundry Service, Concierge, Banquet Room, Air conditioning, Family Rooms, Multilingual Staff, Smoking rooms available, Accessible rooms, Refrigerator in room, Minibar, Conference Facilities, Babysitting, Safe, Swimup Bar, Heated pool, Flatscreen TV, Rooftop Terrace, Breakfast Buffet, Poolside Bar, Indoor pool, Butler Service, Adult pool, Outdoor pool, Parking, Free airport transportation, Free Shuttle or Taxi Services, Facilities for Disabled Guests, Housekeeping, Kids Stay Free, Sauna, Allergy-free Room, Arabic, ATM On Site, Baggage Storage, Bath / Shower, Bathrobes, Blackout Curtains, Bottled Water, Breakfast in the Room, Car Hire, Chinese, Clothes Dryer, Coffee Shop, Coffee / Tea Maker, Complimentary Tea, Convenience Store, Currency Exchange, Desk, Doorperson, English, Evening Entertainment, Facial Treatments, Filipino, Fitness Classes, Fitness / Spa Locker Rooms, Free Public Parking Nearby, Complimentary Instant Coffee, Complimentary Toiletries, French, 24-Hour Front Desk, Gift Shop, Hair Dryer, Hindi, Indonesian, Interconnected room(s) available, Iron, Ironing Service, Italian, Kids' Meals, Kid-Friendly Buffet, Kitchenware, Massage, Newspaper, Nightclub / DJ, Outdoor Furniture, Pool / Beach Towels, Private Check-in / Check-out, Salon, Seating Area, 24-Hour Security, Shoeshine, Shops, Snack Bar, Special Diet Menus, Squash, Steam Room, Sun Loungers / Beach Chairs, Sun Umbrellas, Taxi Service, Telephone, Turkish, Valet Parking, VIP Room Facilities, Wake Up Service / Alarm Clock, Kids pool, Breakfast Available, Air Purifier, Badminton, Bidet, Cable / Satellite TV, Express Check-in / Check-out, Children's Television Networks, Clothes Rack, Dining Area, Electric Kettle, Executive Lounge Access, First Aid Kit, Foot Massage, Complimentary Welcome Drink, Free Wifi in the Business Center, Full Body Massage, Hand Massage, Happy Hour, Head Massage, Highchairs Available, Laptop Safe, Light Therapy, Neck Massage, Nepali, On-Demand Movies, Outdoor Dining Area, Pedicure, Personal Trainer, Pool View, Private Bathrooms, Separate Dining Area, Separate Living Room, Sofa, Sofa Bed, Tamil, Tile / Marble Floor, Umbrella, Wardrobe / Closet, Waterslide, Photo Copier / Fax In Business Center, Yoga Classes, Yoga Room","Green, Mid-range",#20 of 256 hotels in Doha,4.5,4707,$
