location_id,type,name,description,city,country,amenities,styles,ranking,rating,num_reviews,price_level
10364106,hotels,Grand Millennium Muscat,"A tribute to the rich, cultural heritage and time-honored values of Oman, the 5 star Grand Millennium Muscat is located in the heart of the city, close to the airport, and is seamlessly connected to the Muscat Grand Mall. Centrally located in the business, government and diplomatic district, our luxury hotel is uniquely convenient.",Muscat,Oman,"Pool, Internet, Kids Activities, Suites, Room service, Free Internet, Free parking, Wheelchair access, Restaurant, Spa, Airport transportation, Wifi, Public Wifi, Free Wifi, Dry Cleaning, Meeting rooms, Hot Tub, Non-smoking rooms, Business center, Fitness center, Laundry Service, Concierge, Banquet Room, Air conditioning, Family Rooms, Multilingual Staff, Smoking rooms available, Accessible rooms, Minibar, Conference Facilities, Babysitting, Safe, Rooftop Pool, Flatscreen TV, Breakfast Buffet, Outdoor pool, Breakfast Available, Parking, Facilities for Disabled Guests, Kids Stay Free, Arabic, Baggage Storage, Car Hire, 24-Hour Check-in, Doorperson, Filipino, Fitness / Spa Locker Rooms, 24-Hour Front Desk, Ironing Service, 24-Hour Security, Taxi Service, VIP Room Facilities","Centrally Located, Family",#21 of 157 hotels in Muscat,4.5,888,$
299166,hotels,"Crowne Plaza Muscat, an IHG Hotel","Crowne Plaza Muscat is the perfect choice for a beachfront getaway among the leading hotels in Muscat. A 25-minute drive from the airport, our hotel features 200 spacious rooms and suites designed for your comfort. Dive into our double-deck infinity pool, relax on our private beach or energise at the fully-equipped health club. When hunger strikes, indulge in diverse dining options, from Italian to Persian and local dishes, with terraces for watching spectacular sunsets.",Muscat,Oman,"Pool, Room service, Restaurant, Beachfront, Free parking, Tennis Court, Business center, Fitness center, Beach Access, Wheelchair access, Bar/Lounge, Meeting rooms, Laundry Service, Concierge, Internet, Shuttle Bus Service, Suites, Free Internet, Wifi, Public Wifi, Free Wifi, Spa, Dry Cleaning, Non-smoking rooms, Banquet Room, Family Rooms, Multilingual Staff, Air conditioning, Conference Facilities, Safe, Flatscreen TV, Breakfast Buffet, Poolside Bar, Private Balcony, Outdoor pool, Private Beaches, Parking, Free Shuttle or Taxi Services, Facilities for Disabled Guests, Housekeeping, Arabic, Baggage Storage, Bath / Shower, Breakfast in the Room, Bridal Suite, Car Hire, Coffee Shop, Coffee / Tea Maker, Currency Exchange, Doorperson, English, Facial Treatments, Filipino, Fitness Classes, Fitness / Spa Locker Rooms, Complimentary Instant Coffee, Complimentary Toiletries, French, 24-Hour Front Desk, Gift Shop, Hair Dryer, Hindi, Interconnected room(s) available, Ironing Service, Kid-Friendly Buffet, Massage, Pool / Beach Towels, Pool with View, Salon, 24-Hour Security, Shoeshine, Snack Bar, Sun Loungers / Beach Chairs, Sun Terrace, Sun Umbrellas, Taxi Service, VIP Room Facilities, Kids pool, Breakfast Available, Sauna, ATM On Site, Children's Television Networks, Evening Entertainment, Free Wifi in the Business Center, Happy Hour, Highchairs Available, Neck Massage, Outdoor Dining Area, Steam Room, Photo Copier / Fax In Business Center","Bay View, Park View",#22 of 157 hotels in Muscat,4.5,2386,$$
1023336,hotels,Muscat Hills Resort,,Muscat,Oman,"Pool, Free parking, Restaurant, Internet, Beachfront, Free Internet, Bar/Lounge, Airport transportation, Breakfast included, Air conditioning, Minibar, Breakfast Buffet, Outdoor pool, Private Beaches, Bottled Water, Diving, English, Mosquito Net, Pool / Beach Towels, Secured Parking, Snorkeling, Sun Loungers / Beach Chairs, Sun Umbrellas, Beach Access, Safe, Kids pool, Breakfast Available, Arabic, Baggage Storage, Bath / Shower, Canoeing, Clothes Rack, Currency Exchange, Filipino, French, German, Hindi, Ironing Service, Outdoor Furniture, Pool with View, Snack Bar, Sun Terrace, Turkish, Wine / Champagne","Great View, Romantic",#1 of 37 Specialty lodging in Muscat,3.5,585,
5602921,hotels,Salalah Rotana Resort,"Set along the shores of the Indian Ocean, The 5-star waterfront resort's 422 splendid rooms and suites are beautifully built around the lagoons, water features and manmade canals for an unforgettable experience. The upscale hotel's Omani-inspired architecture features a series of clusters surrounding the main building, housing major public facilities and amenities. Salalah Rotana Resort is a scenic 20km drive from Salalah Airport. Salalah Rotana Resort offers individual Experiences tailored for couples, for families and to discover Salalah and the Dhofar region. Click here for more information about the Experiences at Salalah Rotana Resort. With its state-of-the-art facilities, Salalah Rotana Resort is the ideal destination for leisure and business travellers.",Salalah,Oman,"Beachfront, Beach Access, Free parking, Business center, Fitness center, Pool, Internet, Kids Activities, Suites, Room service, Free Internet, Wheelchair access, Restaurant, Bar/Lounge, Spa, Airport transportation, Wifi, Paid Wifi, Paid Internet, Breakfast included, Dry Cleaning, Meeting rooms, Non-smoking rooms, Tennis Court, Laundry Service, Concierge, Banquet Room, Air conditioning, Family Rooms, Multilingual Staff, Accessible rooms, Refrigerator in room, Minibar, Conference Facilities, Babysitting, Safe, Swimup Bar, Flatscreen TV, Breakfast Buffet, Poolside Bar, Private Balcony, Outdoor pool, Private Beaches, Parking, Free Shuttle or Taxi Services, Kids Club, Sauna, Aerobics, Arabic, Baggage Storage, Bicycle Rental, Car Hire, Currency Exchange, Entertainment Staff, Evening Entertainment, Facial Treatments, Fitness Classes, Ironing Service, Massage, Salon, Shops, Sun Umbrellas, Table Tennis","Quiet, Modern",#8 of 103 hotels in Salalah,4.5,4263,$$
14934462,hotels,Millennium Resort Salalah,"Millennium Resort Salalah is a unique modern city resort concept, situated North of Salalah in the area of Al Saada. Enjoy the comfort of 285 elegantly appointed rooms, suites, apartments, chalets and villas",Salalah,Oman,"Pool, Internet, Kids Activities, Shuttle Bus Service, Suites, Room service, Free Internet, Free parking, Wheelchair access, Restaurant, Spa, Airport transportation, Wifi, Public Wifi, Free Wifi, Dry Cleaning, Meeting rooms, Non-smoking rooms, Fitness center, Laundry Service, Concierge, Banquet Room, Air conditioning, Multilingual Staff, Accessible rooms, Safe, Flatscreen TV, Rooftop Terrace, Breakfast Buffet, Outdoor pool, Kids Stay Free, Sauna, Arabic, Bridal Suite, Car Hire, 24-Hour Check-in, English, Facial Treatments, Filipino, Fitness / Spa Locker Rooms, 24-Hour Front Desk, Gift Shop, Hammam, Hindi, Ironing Service, Kids' Meals, Kid-Friendly Buffet, Massage, Salon, 24-Hour Security, Steam Room, Sun Umbrellas, Taxi Service, Business center, Family Rooms, Smoking rooms available, Conference Facilities, Kids pool, Breakfast Available, Facilities for Disabled Guests, Children's Playground, Foot Bath, Foot Massage, Full Body Massage, Hand Massage, Head Massage, Neck Massage, Outdoor Dining Area, Pedicure, Russian, Sun Deck, Turkish","Mid-range, Trendy",#10 of 103 hotels in Salalah,4.5,653,$$
301982,hotels,Hilton Salalah Resort,"The Hilton Salalah Resort is a relaxing retreat, surrounded by vibrant bougainvilleas and lush palm groves. This beachfront Salalah hotel is set amidst landscaped gardens and all of the Salalah hotel rooms and suites offer tranquil views of the Indian Ocean and Arabian Sea, as well as the dramatic Dhofar mountain range. Relax by the Hilton Salalah Resort's freeform pool overlooking the white-sandy beach, browse the shopping arcade, work out in the gym or unwind in 6 restaurants and bars at this Salalah hotel. Dine on fresh seafood at Palm Grove Restaurant or enjoy authentic Arabic Cuisine at Al Maha Restaurant. Sip your favorite cocktails in Sea Breeze Bar, located on the stunning beachfront, or treat yourself at Sheba's Steak House with premium steaks, flavorful sauces and matching wines. Pamper yourself with an outdoor massage in one of the Caribbean style beach pavilions at this Salalah hotel, entertain the kids in the playground or enjoy a day sightseeing and visit the Old Souk, the Bird Sanctuary or follow the Frankincense trail.",Salalah,Oman,"Pool, Business center, Free parking, Restaurant, Fitness center, Room service, Beachfront, Beach Access, Internet, Wheelchair access, Wifi, Kids Activities, Shuttle Bus Service, Suites, Free Internet, Bar/Lounge, Spa, Airport transportation, Paid Wifi, Paid Internet, Dry Cleaning, Meeting rooms, Non-smoking rooms, Tennis Court, Laundry Service, Concierge, Banquet Room, Air conditioning, Family Rooms, Multilingual Staff, Accessible rooms, Minibar, Conference Facilities, Safe, Swimup Bar, Flatscreen TV, Breakfast Buffet, Poolside Bar, Private Balcony, Outdoor pool, Breakfast Available, Housekeeping, Arabic, Baggage Storage, Bath / Shower, Bottled Water, Coffee / Tea Maker, Desk, English, Complimentary Instant Coffee, Complimentary Toiletries, 24-Hour Front Desk, Gift Shop, Ironing Service, Smoking rooms available, Kids pool, Private Beaches, Facilities for Disabled Guests, Sauna, Bathrobes, Bidet, Books, DVDs, Music for Children, Cable / Satellite TV, Car Hire, 24-Hour Check-in, Express Check-in / Check-out, Children's Television Networks, Children's Playground, Clothes Rack, Coffee Shop, Complimentary Tea, Currency Exchange, Diving, Evening Entertainment, Filipino, First Aid Kit, Fishing, Fitness / Spa Locker Rooms, Complimentary Welcome Drink, Free Wifi in the Business Center, German, Hair Dryer, Highchairs Available, Hindi, Indonesian, Indoor Play Area for Children, Interconnected room(s) available, Iron, Kids' Meals, Kid-Friendly Buffet, Laptop Safe, Mountain View, Nepali, Newspaper, Nightclub / DJ, Outdoor Dining Area, Outdoor Furniture, Pool / Beach Towels, Pool View, Pool with View, Private Bathrooms, Private Check-in / Check-out, Radio, Seating Area, 24-Hour Security, Shoeshine, Shops, Sinhala, Snorkeling, Sofa, Sofa Bed, Special Diet Menus, Sun Deck, Sun Loungers / Beach Chairs, Sun Umbrellas, Table Tennis, Tamil, Taxi Service, Telephone, Tile / Marble Floor, Umbrella, Urdu, Valet Parking, VIP Room Facilities, Wake Up Service / Alarm Clock, Walk-in Shower, Wardrobe / Closet, Waterslide, Water Sport Equipment Rentals, Wine / Champagne, Photo Copier / Fax In Business Center","Green, Classic",#12 of 103 hotels in Salalah,4.0,1429,$$$
18187106,hotels,Atana Stay Salalah,"When you think about hotel lobbies as communal hang-out spots, a design that connects the feeling of a place, and a vibe that draws you to the unique essence of the Monsoon region. Atana Stay Salalah 52 modern, comfy and cool décor rooms welcome guests to its new design streak budget hotel.",Salalah,Oman,"Pool, Suites, Room service, Free parking, Wheelchair access, Restaurant, Airport transportation, Wifi, Free Wifi, Breakfast included, Dry Cleaning, Meeting rooms, Non-smoking rooms, Laundry Service, Concierge, Air conditioning, Safe, Private Balcony, Outdoor pool, Breakfast Available, Housekeeping, Kids Club, Arabic, Baggage Storage, Blackout Curtains, Bottled Water, Breakfast in the Room, Car Hire, 24-Hour Check-in, Coffee / Tea Maker, Complimentary Tea, English, Complimentary Instant Coffee, Complimentary Toiletries, Hindi, Interconnected room(s) available, Iron, Ironing Service, Outdoor Furniture, Internet, Kids Activities, Free Internet, Kitchenette, Family Rooms, Flatscreen TV, Breakfast Buffet, Kids pool, Facilities for Disabled Guests, Cable / Satellite TV, Clothes Rack, Dining Area, Electric Kettle, First Aid Kit, Complimentary Welcome Drink, Hair Dryer, Indoor Play Area for Children, Kids' Meals, Kid-Friendly Buffet, Landmark View, Outdoor Dining Area, Pool View, Private Bathrooms, Seating Area, 24-Hour Security, Shallow End, Sofa, Sofa Bed, Taxi Service, Telephone, Tile / Marble Floor, Wake Up Service / Alarm Clock, Walk-in Shower, Wardrobe / Closet","Romantic, City View",#4 of 103 hotels in Salalah,5.0,197,$$
455323,hotels,"Crowne Plaza Resort Salalah, an IHG Hotel","Unwind on our long stretch of white, pristine sandy beach or by the pool with vivid landscapes of Crowne Plaza Resort Salalah.Receive a warm welcome from our friendly Omani staff as you cross 42 acres of lush green gardens and enter our gleaming lobby. The Crowne Plaza Resort Salalah is an indulgent retreat offering a variety of facilities such as three interconnecting pools, tennis and squash courts and 9-hole par-three garden golf course.Our shuttle bus whisks you from Salalah International Airport to the Crowne Plaza Resort Salalah in 25 minutes. We combine a resort getaway with easy access to Salalah's city centre, just 10 minutes' drive away.Locals are drawn to our night-time attractions, from sumptuous themed buffets with Oud music near the white sand at Ocean Blue Beach House to panoramic sunsets and ocean views at Dolphin Terrazza. Al-Khareef Pub, with its rich wood and stained glass, is a homely space serving draught beers.",Salalah,Oman,"Pool, Room service, Restaurant, Business center, Free parking, Fitness center, Shuttle Bus Service, Wheelchair access, Internet, Free Internet, Wifi, Free Wifi, Beachfront, Beach Access, Bar/Lounge, Suites, Spa, Airport transportation, Public Wifi, Dry Cleaning, Meeting rooms, Hot Tub, Golf course, Non-smoking rooms, Tennis Court, Laundry Service, Concierge, Banquet Room, Air conditioning, Family Rooms, Multilingual Staff, Smoking rooms available, Accessible rooms, Refrigerator in room, Minibar, Conference Facilities, Babysitting, Safe, Swimup Bar, Flatscreen TV, Breakfast Buffet, Poolside Bar, Private Balcony, Infinity Pool, Outdoor pool, Parking, Free airport transportation, Free Shuttle or Taxi Services, Facilities for Disabled Guests, Housekeeping, Kids Club, Kids Stay Free, Sauna, Arabic, Baggage Storage, Bath / Shower, Bathrobes, Blackout Curtains, Bottled Water, Breakfast in the Room, Car Hire, 24-Hour Check-in, Coffee Shop, Coffee / Tea Maker, Currency Exchange, Desk, Diving, Doorperson, English, Filipino, Fitness Classes, Fitness / Spa Locker Rooms, Free Private Parking Nearby, Free Public Parking Nearby, Complimentary Toiletries, French, 24-Hour Front Desk, Gift Shop, Hair Dryer, Hindi, Indoor Play Area for Children, Interconnected room(s) available, Iron, Ironing Service, Kids' Meals, Massage, Nightclub / DJ, Pool / Beach Towels, 24-Hour Security, Sun Loungers / Beach Chairs, Sun Umbrellas, Table Tennis, Taxi Service, Telephone, Kids pool, Breakfast Available, ATM On Site, Bidet, Bridal Suite, Children's Playground, Clothes Rack, Couples Massage, Darts, Electric Kettle, Extra Long Beds, Facial Treatments, First Aid Kit, Foot Massage, Free Wifi in the Business Center, Full Body Massage, German, Hand Massage, Head Massage, Highchairs Available, iPod Docking Station, Laptop Safe, Makeup Services, Manicure, Mini Golf, Neck Massage, Nepali, Newspaper, Outdoor Dining Area, Personal Trainer, Picnic Area, Plunge Pool, Pool View, Pool with View, Salon, Seating Area, Secured Parking, Separate Dining Area, Separate Living Room, Shoeshine, Snorkeling, Sofa, Sofa Bed, Soundproof Rooms, Special Diet Menus, Steam Room, Sun Deck, Tile / Marble Floor, Umbrella, Valet Parking, VIP Room Facilities, Wake Up Service / Alarm Clock, Walk-in Shower, Wardrobe / Closet, Waterslide, Photo Copier / Fax In Business Center, Yoga Classes","Classic, Ocean View",#9 of 103 hotels in Salalah,4.5,1450,$$$
10524848,hotels,Al Baleed Resort Salalah by Anantara,"A beachfront oasis that is the first luxury villa resort in Salalah, Al Baleed Resort Salalah by Anantara offers an exhilarating escape to Oman’s rich heritage and hospitality. Opulently designed to reflect the iconic Middle Eastern fortresses, the resort embodies striking Arabian-inspired features combined with towering palms and the scenic beach. The resort is within reach of abundance of natural wonders and cultural gems whilst also located close to the airport and all sightseeing highlights. The luxury accommodation offer a mix of 136 keys including 30 standard rooms, 10 junior suites, 8 villas and 88 private pool villas. Each accommodation type will feature an amazing view of the lush garden or lagoon or the pristine beach. Guestrooms are equipped with interactive LED TV and media hub, coffee and tea making facilities, separate bathtub and rain shower, walk-in dressing room, internet access, 24-hour room service and in-room safe. The villas feature living quarters, each generously spaced out to ensure maximum privacy and seclusion. Three restaurant and lounge venues offer unique culinary experiences: Sakalan, the themed buffet restaurant with live cooking stations; Al Mina, the Mediterranean beachside restaurant and bar where guests can enjoy zesty flavours while enjoying the view of the pool and beach; and Mekong, the resort’s signature restaurant serving delectable Asian specialty cuisines. The resort has a team of passionately dedicated and knowledgeable hosts and ‘gurus’ to deliver customer centric service and outstanding attention to detail. Culture aficionados can take part in historical and cultural tours, foodies can participate in Spice spoons cooking classes; and spa lovers can indulge in Razul treatment rooms and the first hamman in Salalah. Extensive facilities include outdoor infinity pool, fitness centre, tennis court, and teens and kids club. Bespoke activities and excursions are available for guests to enjoy.",Salalah,Oman,"Pool, Internet, Kids Activities, Beachfront, Shuttle Bus Service, Suites, Room service, Free Internet, Free parking, Wheelchair access, Restaurant, Bar/Lounge, Spa, Airport transportation, Wifi, Public Wifi, Free Wifi, Breakfast included, Dry Cleaning, Meeting rooms, Non-smoking rooms, Tennis Court, Business center, Fitness center, Laundry Service, Concierge, Banquet Room, Air conditioning, Family Rooms, Multilingual Staff, Accessible rooms, Refrigerator in room, Minibar, Conference Facilities, Babysitting, Safe, Heated pool, Flatscreen TV, Breakfast Buffet, Poolside Bar, Private Balcony, Butler Service, Infinity Pool, Outdoor pool, Private Beaches, Private Pools, Breakfast Available, Parking, Facilities for Disabled Guests, Kids Club, Sauna, Additional Bathroom, Arabic, Baggage Storage, Bathrobes, Bicycle Rental, Blackout Curtains, Car Hire, Currency Exchange, English, Facial Treatments, Fitness Classes, Fitness / Spa Locker Rooms, Foot Massage, Complimentary Instant Coffee, Complimentary Toiletries, Full Body Massage, Hair Dryer, Ironing Service, Massage, Pool / Beach Towels, Salon, 24-Hour Security, Sun Umbrellas, Taxi Service, Beach Access","Romantic, Bay View",#1 of 103 hotels in Salalah,5.0,2063,$$$$
5596276,hotels,Salalah Gardens Hotel,"Welcome to Salalah Gardens Hotel, your Salalah “home away from home.” Salalah Gardens Hotel aims to make your visit as relaxing and enjoyable as possible, which is why so many guests continue to come back year after year.
While staying at Salalah Gardens Hotel, visitors can check out Sultan Qaboos Mosque (2.1 mi) and Al Hosn Palace (3.1 mi), some of Salalah's top attractions.
Rooms at Salalah Gardens Hotel provide a flat screen TV, air conditioning, and a kitchenette, and guests can stay connected with free wifi.
In addition, while staying at Salalah Gardens Hotel guests have access to a 24 hour front desk, room service, and a concierge. You can also enjoy a pool and breakfast. Need a place to park? Free parking is available at Salalah Gardens Hotel.
While staying at Salalah Gardens Hotel, you can find some great restaurants within walking distance of the hotel including Annabi Restaurant (0.1 mi), Yamal Seafood Restaurant (0.1 mi), and CHANGE Burger & Fries (0.1 mi).
If you’re looking for something to do, Earth Gravity Controversial (0.2 mi) is a nice way to spend some time, and it is within walking distance of Salalah Gardens Hotel.
Salalah Gardens Hotel puts the best of Salalah at your fingertips, making your stay both relaxing and enjoyable.
",Salalah,Oman,"Free parking, Pool, Internet, Kids Activities, Shuttle Bus Service, Suites, Room service, Free Internet, Wheelchair access, Restaurant, Bar/Lounge, Kitchenette, Airport transportation, Wifi, Public Wifi, Free Wifi, Breakfast included, Dry Cleaning, Meeting rooms, Non-smoking rooms, Business center, Fitness center, Laundry Service, Concierge, Banquet Room, Air conditioning, Family Rooms, Multilingual Staff, Microwave, Refrigerator in room, Conference Facilities, Non-smoking hotel, Safe, Flatscreen TV, Breakfast Buffet, Outdoor pool, Free airport transportation, Kids Stay Free, Arabic, ATM On Site, Baggage Storage, BBQ Facilities, Car Hire, Coffee Shop, Convenience Store, Currency Exchange, Doorperson, English, Filipino, 24-Hour Front Desk, Gift Shop, Hindi, Iron, Ironing Service, Kids' Meals, 24-Hour Security, Shoeshine, Shops, Steam Room, Taxi Service, Spa, Breakfast Available, VIP Room Facilities","Modern, Quiet",#2 of 103 hotels in Salalah,4.5,705,$$
10511164,hotels,IntercityHotel Salalah,"IntercityHotel Salalah is located in the centre of business district in Salalah with close proximity to all government institutions and shopping centers. IntercityHotel Salalah offers simple yet modern and fully air conditioned accommodations, free WiFi, a fitness center, roof top swimming pool & steam room, Al Luban all-day dining and Taqa lobby lounge & cafe and two meeting rooms. All rooms are",Salalah,Oman,"Pool, Internet, Room service, Free Internet, Free parking, Wheelchair access, Restaurant, Airport transportation, Wifi, Public Wifi, Free Wifi, Dry Cleaning, Meeting rooms, Non-smoking rooms, Business center, Fitness center, Laundry Service, Air conditioning, Multilingual Staff, Safe, Breakfast Buffet, Parking, Housekeeping, Arabic, Baggage Storage, Bath / Shower, Desk, Suites, Concierge, Family Rooms, Smoking rooms available, Conference Facilities, Non-smoking hotel, Outdoor pool, Breakfast Available, Coffee Shop, Currency Exchange, English, Complimentary Toiletries, 24-Hour Front Desk, Hair Dryer, Hindi, Iron, Laptop Safe, Seating Area, 24-Hour Security, Steam Room, Telephone, Wake Up Service / Alarm Clock","Centrally Located, Trendy",#13 of 103 hotels in Salalah,4.5,122,$
12688903,hotels,Gateway Salalah Serviced Apartments,"Finding an ideal charming hotel in Salalah does not have to be difficult. Welcome to Gateway Salalah, a nice option for travelers like you.
Gateway Salalah offers guests an array of room amenities including a flat screen TV, air conditioning, and a refrigerator, and getting online is possible, as free wifi is available.
The hotel offers a 24 hour front desk, a concierge, and room service, to make your visit even more pleasant. Guests arriving by vehicle have access to free parking.
Close to some of Salalah's most popular landmarks, such as Sultan Qaboos Mosque (1.8 mi) and Nabi Umran A.S Tomb (2.8 mi), Gateway Salalah is a great destination for tourists.
If you’re looking for an Italian restaurant, consider a visit to ‪Ipizza‬, which is not far from Gateway Salalah.
Should time allow, Earth Gravity Controversial is a popular attraction that is within walking distance.
Gateway Salalah puts the best of Salalah at your fingertips, making your stay both relaxing and enjoyable.
",Salalah,Oman,"Internet, Suites, Room service, Free parking, Wheelchair access, Restaurant, Kitchenette, Wifi, Free Wifi, Dry Cleaning, Non-smoking rooms, Laundry Service, Concierge, Air conditioning, Microwave, Refrigerator in room, Breakfast Available, Housekeeping, Kids Stay Free, Additional Bathroom, Arabic, Baggage Storage, Bath / Shower, Bottled Water, Breakfast in the Room, Coffee / Tea Maker, English, Complimentary Toiletries, 24-Hour Front Desk, Hindi, Iron, Ironing Service, Kitchenware, Newspaper, Seating Area, Secured Parking, Shared Lounge / TV Area, Shoeshine, Soundproof Rooms, Street Parking, Taxi Service, Telephone, Shuttle Bus Service, Free Internet, Airport transportation, Business center, Family Rooms, Smoking rooms available, Non-smoking hotel, Flatscreen TV, Bicycles Available, Cable / Satellite TV, Car Hire, Express Check-in / Check-out, Clothes Rack, Complimentary Tea, Currency Exchange, Dining Area, Electric Kettle, Complimentary Instant Coffee, Complimentary Welcome Drink, Mountain View, Oven, Private Bathrooms, Separate Dining Area, Separate Living Room, Sofa, Stovetop, Tile / Marble Floor, Wake Up Service / Alarm Clock, Washing Machine, Photo Copier / Fax In Business Center","Budget, Family",#3 of 103 hotels in Salalah,5.0,247,$$
